{"schema_version":"1.0.0","subject":"https://monarkgate.tech/ukemi/book/weth/23545087.json","chain":"eip155:1","protocol":"aave-v3-core","cluster":"weth","block":{"number":23545087,"hash":"0x49473c228abe17083d5a1c369031444a7b212efa97f07e4de28b736ecea5f22a"},"book_digest":"034fbff9eb2ef08079ed478960fcfa86e0e4db6d1c3946156e9170358976b921","holders_digest":"529bf2b8ba33201d1735193729ddbccac5e0ac20032073e77a03767de31bf110","oracle_sources":[{"asset":"0xa0b86991c6218b36c1d19d4a2e9eb0ce3606eb48","source":"0x3f73f03aa83b2a48ed27e964ed0fdb590332095b","description":"Capped USDC / USD"},{"asset":"0xc02aaa39b223fe8d0a0e5c4f27ead9083c756cc2","source":"0x5424384b256154046e9667ddfaaa5e550145215e","description":"ETH / USD"},{"asset":"0xdac17f958d2ee523a2206206994597c13d831ec7","source":"0x260326c220e469358846b187ee53328303efe19c","description":"Capped USDT/USD"}],"eligible":{"n_positions":0,"debt_base":"0","collateral_base":"0"},"providers":[{"name":"drpc","method":"eth_call","ok":true},{"name":"mevblocker","method":"eth_call","ok":true},{"name":"drpc","method":"getLogs","ok":true},{"name":"mevblocker","method":"getLogs","ok":true}],"quorum":{"required":2,"achieved":2},"abstain":{"value":false,"reason":null},"residual":["no_third_party_verifier","rpc_quorum_2_keyless","oracle_price_as_read","oracle_source_as_read","block_timestamp_not_submission"],"attestor":{"kind":"recorder","key":"deadbeef"},"recorder_revision":"ukemi-recorder@0000000000000000000000000000000000000000000000000000000000000000","observed_at":{"clock":"block","instant":1760072195}}
